parsed_docs_2405.09818v1/tables/table_pg14_num1.md.csv

,Chameleon,Chameleon,Llama-2,Llama-2,Llama-2,Mistral,Mistral,Gemini Pro,GPT- 4
,7B,34B,7B,34B,70B,7B,8x7B,,
Commonsense Reasoning and Reading Comprehension,Commonsense Reasoning and Reading Comprehension,Commonsense Reasoning and Reading Comprehension,Commonsense Reasoning and Reading Comprehension,Commonsense Reasoning and Reading Comprehension,Commonsense Reasoning and Reading Comprehension,Commonsense Reasoning and Reading Comprehension,Commonsense Reasoning and Reading Comprehension,Commonsense Reasoning and Reading Comprehension,Commonsense Reasoning and Reading Comprehension
PIQA,79.6,83.3,78.8,81.9,82.8,83.0,83.6,,
SIQA,57.0,63.3,48.3,50.9,50.7,,,,
HellaSwag,74.2,82.7,77.2,83.3,85.3,81.3,84.4,,
,75.6 10-shot,85.1 10-shot,,,87.1 10-shot,83.9 10-shot,86.7 10-shot,84.7 10-shot,95.3 10-shot
WinoGrande,70.4,78.5,69.2,76.7,80.2,75.3,77.2,,
Arc-E,76.1,84.1,75.2,79.4,80.2,80.0,83.1,,
Arc-C,46.5,59.7,45.9,54.5,57.4,55.5,59.7,,
OBQA,51.0,54.0,58.6,58.2,60.2,,,,
BoolQ,81.4,86.0,77.4,83.7,85.0,84.7*,,,
Math and World Knowledge,Math and World Knowledge,Math and World Knowledge,Math and World Knowledge,Math and World Knowledge,Math and World Knowledge,Math and World Knowledge,Math and World Knowledge,Math and World Knowledge,Math and World Knowledge
GSM8k,41.6,61.4,14.6,42.2,56.8,52.1 maj@8,74.4 maj@8,86.5 maj@32,92.0 SFT
,50.9 maj@8,77.0 maj@32,,,,,75.1* maj@32,CoT,CoT
MATH,11.5 maj@1,22.5 maj@1,2.5,6.24,13.5,13.1 maj@4,28.4 maj@4,32.6,52.9**
,12.9 maj@4,24.7 maj@4,,,,,,,
MMLU,52.1,65.8,45.3,62.6,68.9,60.1,70.6,71.8,86.4

parsed_docs_2405.09818v1/document.md

## 5.1 Text

<span id="page-15-0"></span>
• MATH and World Knowledge We report 8-shot performance on GSM8K (Cobbe et al., 2021) i.e., grade school math word problems and 4-shot performance on the MATH (Hendrycks et al., 2021) benchmark. We report maj@N exact match accuracy for both benchmarks by sampling N generations from the model (greedy sampling for N=1) and choosing the answer via majority voting. Despite training for additional modalities, both Chameleon models demonstrate strong math capabilities. On GSM8k, Chameleon-7B outperforms the corresponding Llama-2 models, with performance comparable to Mistral 7B (50.9 vs 52.1 maj@8). Furthermore, Chameleon-34B can outperform Llama2-70B on maj@1 (61.4 vs 56.8) and Mixtral 8x7B on maj@32 (77.0 vs 75.1). Similarly, on MATH, Chameleon-7B outperforms Llama-2 and matches Mistral 7B on maj@4, while Chameleon-34B outperforms Llama2-70B, approaching the performance of Mixtral 8x7B on maj@4 (24.7 vs 28.4).

We also report performance on MMLU (Hendrycks et al., 2020), which measures world/in-domain knowledge and problem-solving abilities using 57 subjects, including elementary mathematics, US history, computer science, and law. Both Chameleon models outperform their Llama-2 counterparts with Chameleon-34B approaching the performance of Mixtral 8x7B/Gemini-Pro (65.8 vs 70.6/71.8).