parsed_docs_STEPBACK/tables/table_pg5_num0.md.csv

Method,TimeQA,TQA Easy,TQA Hard,SituatedQA
PaLM-2L,41.5%,42.6%,40.4%,54.3% (0.3%)
PaLM-2L 1-shot,40.7%,41.7%,39.1%,51.8% (0.6%)
PaLM-2L +CoT,40.8%,41.8%,39.8%,56.4% (0.2%)
PaLM-2L+CoT1-shot,38.1%,39.3%,36.8%,54% (0.8%)
PaLM-2L+TDB,40.9%,42.6%,39.1%,54% (0.5%)
PaLM-2L +RAG,57.4%,67.8%,46.8%,59.3% (0.4%)
PaLM-2L + Step-Back (ours),66%,70.4%,61.6%,57.5% (0.3%)
PaLM-2L + Step-Back +RAG (ours),68.7%,75.2%,62.3%,61% (0.4%)
GPT-4,45.6%,48.9%,42.6%,63.2% (0.4%)

parsed_docs_STEPBACK/document.md

## 5.2 RESULTS

We evaluate the models on the test-set of TimeQA. As shown in Table 2, the baseline models of GPT-4 and PaLM-2L achieved 45.6% and 41.5%, highlighting the difficulty of the task. Applying either CoT or TDB zero-shot (and one-shot) prompting to the baseline model shows no improvement. In contrast, augmenting the baseline model by regular retrieval augmentation (RAG) improves the accuracy to 57.4%, highlighting the factual intensive nature of the task. The result of Step-Back + RAG shows the effectiveness of going back to a high-level concept, which enables much more reliable retrieval augmentation: the accuracy on TimeQA achieves a remarkable 68.7%.

Next, we segment TimeQA into the Easy and Hard difficulty level provided in the original dataset. As expected, all methods perform worse on the Hard segment. While RAG can improve the Easy accuracy from 42.6% to 67.8%, the improvement is much smaller on the Hard accuracy: 40.4% to 46.8%. This is where STEP-BACK PROMPTING really shines by retrieving facts regarding high-level concepts to ground the final reasoning: Step-Back + RAG further improves the Hard accuracy to 62.3%, outperforming 42.6% from GPT-4. We hypothesis that facts regarding the high-level concepts (such as education history) is much more accessible than the low-level details.