parsed_docs_2020.acl-main.207/tables/table_pg6_num0.image.csv

Task →,Classification,User activity prediction,Citation prediction,Recomm.,Avg.
Subtask →,MAG,MeSH,Co-View,Co-Read,"Cite,Co-Cite,nDCG,P@1,Avg."
Model ↓ / Metric →,F1,F1,MAP,nDCG,"MAP,nDCG,MAP,nDCG,nDCG,P@1"
Random,4.8,9.4,25.2,51.6,"25.6,51.9,25.1,51.5,24.9,51.4,51.3,16.8,32.5"
Doc2vec (2014),66.2,69.2,67.8,82.9,"64.9,81.6,65.3,82.2,67.1,83.4,51.7,16.9,66.6"
Fasttext-sum (2017),78.1,84.1,76.5,87.9,"75.3,87.4,74.6,88.1,77.8,89.6,53.4,18.0,74.1"
SIF (2017),78.4,81.4,79.4,89.4,"78.2,88.9,79.4,90.5,80.8,90.9,53.4,19.5,75.9"
ELMo (2018),77.0,75.7,70.3,84.3,"67.4,82.6,65.8,82.6,68.5,83.8,52.5,18.2,69.0"
Citeomatic (2018),67.1,75.7,81.1,90.2,"80.5,90.2,86.3,94.1,84.4,92.8,52.5,17.3,76.0"
SGC (2019a),76.8,82.7,77.2,88.0,"75.7,87.5,91.6,96.2,84.1,92.5,52.7,18.2,76.9"
SciBERT (2019),79.7,80.7,50.7,73.1,"47.7,71.1,48.3,71.7,49.7,72.6,52.1,17.9,59.6"
Sent-BERT (2019),80.5,69.1,68.2,83.3,"64.8,81.3,63.5,81.6,66.4,82.8,51.6,17.1,67.5"
SPECTER (Ours),82.0,86.4,83.6,91.5,"84.5,92.4,88.3,94.9,88.1,94.8,53.9,20.0,80.0"

parsed_docs_2020.acl-main.207/document.md

## 5 Results

Table 1 presents the main results corresponding to our evaluation tasks (described in §3). Overall, we observe substantial improvements across all tasks with average performance of 80.0 across all metrics on all tasks which is a 3.1 point absolute improvement over the next-best baseline. We now discuss the results in detail.

For document classification, we report macro F1, a standard classification metric. We observe that the classifier performance when trained on our representations is better than when trained on any other baseline. Particularly, on the MeSH (MAG) dataset, we obtain an 86.4 (82.0) F1 score which is about a ∆= + 2.3 (+1.5) point absolute increase over the best baseline on each dataset respectively. Our evaluation of the learned representations on predicting user activity is shown in the “User activity” columns of Table 1. SPECTER achieves a MAP score of 83.8 on the co-view task, and 84.5 on coread, improving over the best baseline (Citeomatic in this case) by 2.7 and 4.0 points, respectively. We observe similar trends for the “citation” and “co-citation” tasks, with our model outperforming virtually all other baselines except for SGC, which has access to the citation graph at training and test time.12 Note that methods like SGC cannot be used in real-world setting to embed new papers that are not cited yet. On the other hand, on cocitation data our method is able to achieve the best results with nDCG of 94.8, improving over SGC with 2.3 points. Citeomatic also performs well on the citation tasks, as expected given that its primary design goal was citation prediction. Nevertheless, our method slightly outperforms Citeomatic on the direct citation task, while substantially outperforming it on co-citations (+2.0 nDCG).