parsed_docs_2305.13186v3/tables/table_pg6_num0.csv

Models,# of Para.,Zero-shot 2-class,Zero-shot 3-class,In-Context 2-class,In-Context 3-class
Table-based LLMs,"TAPAS-large (Tabfact) (Herzig et al., 2020)",50.30,,,
Table-based LLMs,"TAPEX-large (Tabfact) (Liu et al., 2022b)",56.06,,,
Table-based LLMs,"TAPEX-Zero-large (Liu et al., 2023b)",48.28,29.72,42.44,23.47
Table-based LLMs,"TAPEX-Zero-XL (Liu et al., 2023b)",49.77,34.30,42.12,25.62
Encoder–Decoder LLMs,"Flan-T5-base (Chung et al., 2022)",47.38,26.56,44.82,24.09
Encoder–Decoder LLMs,"Flan-T5-large (Chung et al., 2022)",51.58,32.55,49.62,27.30
Encoder–Decoder LLMs,"Flan-T5-XL (Chung et al., 2022)",52.41,38.05,48.05,29.21
Encoder–Decoder LLMs,"Flan-T5-XXL (Chung et al., 2022)",59.60,34.91,60.48,34.04
Open source LLMs,"Alpaca-7B (Taori et al., 2023)",37.22,27.59,40.46,28.95
Open source LLMs,"Vicuna-7B (Chiang et al., 2023)",63.62,32.47,50.35,34.26
Open source LLMs,"Vicuna-13B (Chiang et al., 2023)",41.82,29.63,55.11,35.16
Open source LLMs,"LLaMA-7B (Touvron et al., 2023)",49.05,32.26,45.24,27.17
Open source LLMs,"LLaMA-13B (Touvron et al., 2023)",53.97,37.18,44.39,32.66
Close source LLMs,"InstructGPT (Ouyang et al., 2022)",68.44,41.41,68.10,41.58
Close source LLMs,"InstructGPT+CoT (Ouyang et al., 2022)",--,--,68.46,42.60
Close source LLMs,"PoT (Chen et al., 2022)",--,--,63.79,
Close source LLMs,"GPT-4 (OpenAI, 2023)",78.22,64.80,77.98,63.21
Close source LLMs,"GPT-4+CoT (OpenAI, 2023)",--,--,,
Human,,,,92.40,84.73

parsed_docs_2305.13186v3/document.md

## 4.2 Main Results

1. In general, all open source LLMs, including encoder–decoder models and decoder-only models, do not achieve very promising results on SCITAB and they still have a large gap from human performance. The best result is 63.62 for the 2-class setting (Vicuna-7B and 38.05 for the 3-class setting (FLAN-T5-XL). Both results are only moderately better (+13.62 and +4.72) than random guessing. In contrast, a well-trained human annotator can achieve 92.46 and 84.73 F1 scores in the 2- class and 3-class settings, respectively. This reveals the challenging nature of SCITAB and its potential to be the future benchmark for scientific fact-checking.

### Full Page Description (Page 7)

5. Closed source LLMs perform better than open source LLMs, with GPT-4 achieving 78.22 macro-F1 for the 2-class setting and 64.80 for the 3-class setting. This aligns with the assertion that GPT-4 has a strong ability to perform complex reasoning (OpenAI, 2023) and we show that this ability can generalize to tabular data as well. However, the black-box nature of OpenAI models restricts our further analysis of its behavior.